{"schema_version":1,"case_id":"plan-fixture","version":1,"kind":"function","adapter":"planfixture.adapter:Unused",
 "description":"synthetic plan fixture: three computation steps on every record of one request (unit-test data only)",
 "work_unit":"one record evaluation (three steps)",
 "parameters":{"p1":{"value":0.04,"label":"assumption","note":"synthetic constant; not measured data"},"p2":{"value":0.012,"label":"assumption","note":"synthetic constant; not measured data"},
  "p3":{"value":100,"label":"declared"},"p4":{"value":5.0,"label":"declared"},"p5":{"value":50,"label":"declared"},
  "p6":{"value":0.0001,"label":"declared"},"p7":{"value":0.001,"label":"declared"},"seed":{"value":20261007,"label":"declared"}},
 "variants":[{"id":"py-reference","language":"python","workers":["direct"],"status":"implemented"},
  {"id":"py-optimized","language":"python","workers":["direct"],"status":"implemented"},
  {"id":"py-threads","language":"python","workers":[1,2,4],"status":"implemented"},
  {"id":"py-processes","language":"python","workers":[1,2,4],"status":"implemented"},
  {"id":"c-serial","language":"c","workers":["direct"],"status":"planned-phase-2"},
  {"id":"c-threads","language":"c","workers":[1,2,4],"status":"planned-phase-2"}],
 "scopes":["kernel","caller","capacity"],"sizes":["tiny","small","medium","large"],
 "points":[
  {"name":"baseline","scope":"caller","size":"medium","modes":["warm","cold"],"variants":["py-reference","py-optimized","py-threads","py-processes","c-serial","c-threads"],"class":"primary"},
  {"name":"full-dataset","scope":"caller","size":"large","modes":["warm","cold"],"variants":["py-optimized","py-threads","py-processes","c-serial","c-threads"],"class":"primary"},
  {"name":"language-only","scope":"kernel","size":"medium","modes":["direct"],"variants":["py-reference","py-optimized","c-serial"],"class":"primary"},
  {"name":"crossover-tiny","scope":"caller","size":"tiny","modes":["warm","cold"],"variants":["py-reference","py-optimized","py-threads","py-processes","c-serial","c-threads"],"class":"secondary"},
  {"name":"crossover-small","scope":"caller","size":"small","modes":["warm","cold"],"variants":["py-reference","py-optimized","py-threads","py-processes","c-serial","c-threads"],"class":"secondary"}],
 "opportunity_record":null}
