{"schema_version":1,"case_id":"option-chain-greeks","version":5,"kind":"function","adapter":"optionlab.adapter:OptionChainGreeks",
 "description":"IV from mid, then price and five greeks, for the selected model (BSM, Bjerksund-Stensland 1993, CRR(100), Barone-Adesi-Whaley or Andersen-Lake-Offengenden: the QuantLib 1.43 engines) on every contract of one chain; the selector all evaluates BSM, Bjerksund-Stensland and CRR",
 "work_unit":"one contract evaluation of the selected models (IV, price, delta, gamma, theta, vega, rho)",
 "parameters":{"rate":{"value":0.04,"label":"assumption","note":"continuous, flat; not market data"},"dividend_yield":{"value":0.012,"label":"assumption","note":"continuous, flat; not market data"},
  "crr_steps":{"value":100,"label":"declared"},"sigma_hi":{"value":5.0,"label":"declared"},"kappa_cap":{"value":50,"label":"declared"},
  "h_r":{"value":0.0001,"label":"declared"},"h_sigma":{"value":0.001,"label":"declared"},"seed":{"value":20261007,"label":"declared"},
  "baw_newton_max":{"value":40,"label":"protocol","note":"BAW critical-price update cap (spec Appendix G-BAW R3); a cap hit on an admitted point is a run defect"},
  "alo_scheme":{"value":{"name":"accurateScheme","class":"QdFpLegendreTanhSinhScheme","l":25,"m":5,"n":13,"eps":1e-8,"fp_equation":"Auto"},"label":"protocol","note":"Amendment I2.2; a change is a new definition"}},
 "variants":[{"id":"py-reference","language":"python","workers":["direct"],"status":"implemented"},
  {"id":"py-optimized","language":"python","workers":["direct"],"status":"implemented"},
  {"id":"py-library","language":"python-library","workers":["direct"],"status":"implemented","reason":"QuantLib-Python: C++ library through SWIG; per-evaluation Python callback cost included"},
  {"id":"c-serial","language":"c","workers":["direct"],"status":"implemented","routes":["stdio","shm","inproc"]}],
 "scopes":["kernel","caller","capacity"],"sizes":["tiny","small","medium","large"],
 "selectors":["all","bsm","bjs","crr","baw","alo"],
 "call_deadline":{"selectors":["baw"],"reason":"baw-hang","factor":10,"floor_seconds":60},
 "call_deadlines":[{"selectors":["alo"],"reason":"alo-overrun","factor":10,"floor_seconds":60}],
 "points":[
  {"name":"baseline","scope":"caller","size":"medium","modes":["warm","cold"],"variants":["py-reference","py-optimized","py-library","c-serial"],"class":"primary","routes":["stdio","shm","inproc"]},
  {"name":"full-dataset","scope":"caller","size":"large","modes":["warm","cold"],"variants":["py-optimized","py-library","c-serial"],"class":"primary","routes":["stdio","shm","inproc"]},
  {"name":"language-only","scope":"kernel","size":"medium","modes":["direct"],"variants":["py-reference","py-optimized","c-serial"],"class":"primary"},
  {"name":"crossover-tiny","scope":"caller","size":"tiny","modes":["warm","cold"],"variants":["py-reference","py-optimized","py-library","c-serial"],"class":"secondary","routes":["stdio"]},
  {"name":"crossover-small","scope":"caller","size":"small","modes":["warm","cold"],"variants":["py-reference","py-optimized","py-library","c-serial"],"class":"secondary","routes":["stdio"]},
  {"name":"unit-bsm-full","scope":"caller","size":"large","modes":["warm","cold"],"variants":["py-optimized","py-library","c-serial"],"class":"primary","selector":"bsm","unit":"bsm/full-dataset","routes":["stdio","shm","inproc"]},
  {"name":"unit-bjs-full","scope":"caller","size":"large","modes":["warm","cold"],"variants":["py-optimized","py-library","c-serial"],"class":"primary","selector":"bjs","unit":"bjs/full-dataset","routes":["stdio","shm","inproc"]},
  {"name":"unit-crr-full","scope":"caller","size":"large","modes":["warm","cold"],"variants":["py-optimized","py-library","c-serial"],"class":"primary","selector":"crr","unit":"crr/full-dataset","routes":["stdio","shm","inproc"]},
  {"name":"unit-baw-full","scope":"caller","size":"large","modes":["warm","cold"],"variants":["py-optimized","py-library","c-serial"],"class":"primary","selector":"baw","unit":"baw/full-dataset","routes":["stdio","shm","inproc"]},
  {"name":"unit-alo-full","scope":"caller","size":"large","modes":["warm","cold"],"variants":["py-optimized","py-library","c-serial"],"class":"primary","selector":"alo","unit":"alo/full-dataset","routes":["stdio","shm","inproc"]},
  {"name":"unit-bsm-one","scope":"caller","size":"tiny","modes":["warm","cold"],"variants":["py-reference","py-optimized","py-library","c-serial"],"class":"primary","selector":"bsm","unit":"bsm/single-record","panel":[11798,11404,9110,2124,2021,492],"dataset_ref":"synthetic:large#panel","routes":["stdio","shm","inproc"]},
  {"name":"unit-bjs-one","scope":"caller","size":"tiny","modes":["warm","cold"],"variants":["py-reference","py-optimized","py-library","c-serial"],"class":"primary","selector":"bjs","unit":"bjs/single-record","panel":[11798,11404,9110,2124,2021,492],"dataset_ref":"synthetic:large#panel","routes":["stdio","shm","inproc"]},
  {"name":"unit-crr-one","scope":"caller","size":"tiny","modes":["warm","cold"],"variants":["py-reference","py-optimized","py-library","c-serial"],"class":"primary","selector":"crr","unit":"crr/single-record","panel":[11798,11404,9110,2124,2021,492],"dataset_ref":"synthetic:large#panel","routes":["stdio","shm","inproc"]},
  {"name":"unit-baw-one","scope":"caller","size":"tiny","modes":["warm","cold"],"variants":["py-reference","py-optimized","py-library","c-serial"],"class":"primary","selector":"baw","unit":"baw/single-record","panel":[11798,11404,9110,2124,2021,492],"dataset_ref":"synthetic:large#panel","routes":["stdio","shm","inproc"]},
  {"name":"unit-alo-one","scope":"caller","size":"tiny","modes":["warm","cold"],"variants":["py-reference","py-optimized","py-library","c-serial"],"class":"primary","selector":"alo","unit":"alo/single-record","panel":[11798,11404,9110,2124,2021,492],"dataset_ref":"synthetic:large#panel","routes":["stdio","shm","inproc"]}],
 "capacity":{"tier":"small","clients":[1],"requests_per_client":8,"configurations":[{"name":"serial-workers","variant":"py-optimized"}]},
 "opportunity_record":"benchmarks/project/cases/option-chain-greeks.opportunity.json"}
