{"schema_version":1,"case_id":"fixture-case","version":1,"kind":"function","adapter":"fixturecase.adapter:FixtureCase",
 "description":"Unit-test fixture only (FR1, FS1 F3): the declaration shape that framework unit tests need from a project case. Never run; no adapter module exists.",
 "work_unit":"one synthetic row",
 "parameters":{"seed":{"value":20261007,"label":"protocol"}},
 "variants":[{"id":"py-reference","language":"python","workers":["direct"],"status":"implemented"},
  {"id":"py-optimized","language":"python","workers":["direct"],"status":"same-as-reference","reason":"fixture: no separate optimized implementation"},
  {"id":"py-library","language":"python-library","workers":["direct"],"status":"implemented","reason":"fixture: the variant that the stub call deadlines cover"},
  {"id":"c-serial","language":"c","workers":["direct"],"status":"planned-phase-2"}],
 "scopes":["kernel","caller"],"sizes":["tiny","small","medium","large"],"selectors":["all","m4","m5"],
 "call_deadline":{"selectors":["m4"],"reason":"stub-hang","factor":10,"floor_seconds":60},
 "call_deadlines":[{"selectors":["m5"],"reason":"stub-overrun","factor":10,"floor_seconds":60}],
 "points":[{"name":"baseline","scope":"caller","size":"medium","modes":["warm","cold"],"variants":["py-reference","py-optimized","py-library","c-serial"],"class":"primary"},
  {"name":"language-only","scope":"kernel","size":"medium","modes":["direct"],"variants":["py-reference","py-optimized","c-serial"],"class":"primary"},
  {"name":"crossover-tiny","scope":"caller","size":"tiny","modes":["warm","cold"],"variants":["py-reference","py-optimized","py-library","c-serial"],"class":"secondary"}],
 "opportunity_record":"benchmarks/project/cases/fixture-case.opportunity.json"}
